{
  "format": "infomap-network-json",
  "version": "1.0",
  "nodes": [
    { "id": 1, "meta": 0 },
    { "id": 2, "meta": 0 },
    { "id": 3, "meta": 1 },
    { "id": 4, "meta": 1 },
    { "id": 5, "meta": 0 },
    { "id": 6, "meta": 0 }
  ],
  "edges": [
    { "source": 1, "target": 2 },
    { "source": 1, "target": 3 },
    { "source": 2, "target": 3 },
    { "source": 3, "target": 4 },
    { "source": 4, "target": 5 },
    { "source": 4, "target": 6 },
    { "source": 5, "target": 6 }
  ]
}
